{
  "$schema": "https://json-schema.org/draft/2020-12/schema",
  "$id": "https://mechaminer.local/schemas/mech.schema.json",
  "title": "SCH-CNT-002 mech definition",
  "description": "A playable mech definition. The project-owned typed validator in src/MechaMiner.Content/Categories/ remains authoritative; this schema is the draft 2020-12 mirror kept for editor and tool interoperability, and a fixture corpus proves the two reach the same accept/reject verdict on every structural case. See content/schemas/README.md.",
  "type": "object",
  "additionalProperties": false,
  "propertyNames": {
    "$ref": "#/$defs/snake_case_field"
  },
  "required": [
    "id",
    "schema_version",
    "content_version",
    "status",
    "tags",
    "source_refs",
    "signature_weapon_id",
    "selection_order",
    "selection_role",
    "inherent_trait",
    "top_down_silhouette",
    "rules"
  ],
  "properties": {
    "id": {
      "title": "A stable, case-sensitive ASCII content ID",
      "type": "string",
      "pattern": "^MCH-[0-9]{2}$"
    },
    "schema_version": {
      "$ref": "#/$defs/version"
    },
    "content_version": {
      "$ref": "#/$defs/version"
    },
    "status": {
      "$ref": "#/$defs/status"
    },
    "name_key": {
      "$ref": "#/$defs/name_key"
    },
    "summary_key": {
      "$ref": "#/$defs/summary_key"
    },
    "tags": {
      "$ref": "#/$defs/tags"
    },
    "source_refs": {
      "$ref": "#/$defs/source_refs"
    },
    "presentation_id": {
      "$ref": "#/$defs/presentation_id"
    },
    "signature_weapon_id": {
      "type": "string",
      "pattern": "^W-[A-F]{2}$",
      "description": "The weapon this mech deploys with. Grammar only: whether the weapon exists is a relational check."
    },
    "selection_order": {
      "type": "integer",
      "description": "The one-based position in the selection screen's order. That no two mechs share one is a catalog-level check.",
      "minimum": 1,
      "x-authority": {
        "minimum": {
          "source": "TDD-CONTENT-DATA",
          "section": "Unit and numeric policy",
          "kind": "sourced",
          "derivation": "the section makes integer currency and rank values integral in source; a count of things that exist begins at one, because a count of zero is the absence of the field rather than a value of it"
        }
      }
    },
    "selection_role": {
      "type": "string",
      "description": "The one-phrase comparison text for the selection screen."
    },
    "is_recommended_default": {
      "type": "boolean",
      "description": "Whether the selection screen recommends this mech. False is the materialized default for the mechs that omit the key."
    },
    "inherent_trait": {
      "title": "A mech's inherent trait",
      "description": "One always-on modifier of one named statistic.",
      "type": "object",
      "additionalProperties": false,
      "properties": {
        "name_key": {
          "$ref": "#/$defs/name_key"
        },
        "affected_statistic": {
          "$ref": "#/$defs/named_statistic"
        },
        "modifier_kind": {
          "type": "string",
          "description": "How the value combines with the baseline. Two arms, so exactly one shape is structural rather than a rule about two optional siblings.",
          "enum": [
            "additive-percent",
            "additive-flat-hull"
          ]
        },
        "modifier_value": {
          "type": "number",
          "description": "The magnitude, in the unit the kind implies. An inherent trait is a positive always-on modifier.",
          "exclusiveMinimum": 0,
          "x-authority": {
            "exclusiveMinimum": {
              "source": "TDD-CONTENT-DATA",
              "section": "Unit and numeric policy",
              "kind": "sourced",
              "derivation": "the section makes durations nonnegative and rates non-negative; this quantity is additionally one the definition divides by, scales by, or spends, so zero is excluded as well and the bound is exclusive rather than inclusive"
            }
          }
        },
        "behavior_kind": {
          "type": "string",
          "description": "The registered trait behavior. A lower-kebab-case token. Whether it resolves to exactly one registered behavior descriptor is the behavior registry's check and is deliberately not asserted here.",
          "pattern": "^[a-z][a-z0-9]*(-[a-z0-9]+)*$"
        }
      },
      "required": [
        "name_key",
        "affected_statistic",
        "modifier_kind",
        "modifier_value"
      ]
    },
    "matching_utility_id": {
      "type": "string",
      "pattern": "^UTL-[A-FR][1-9]$",
      "description": "The utility that modifies the same statistic as the trait. Kept so the balance report can render the stacking comparison the definitions no longer carry."
    },
    "base_overrides": {
      "title": "A mech's overrides of the player baseline",
      "description": "Declared and unpopulated on purpose: doc 40 asks a mech for base overrides and no mech has any, so declaring the object is what makes a future override expressible without a schema change.",
      "type": "object",
      "additionalProperties": false,
      "properties": {
        "maximum_hull_integrity": {
          "type": "integer",
          "description": "Overrides the player baseline.",
          "exclusiveMinimum": 0,
          "x-authority": {
            "exclusiveMinimum": {
              "source": "TDD-CONTENT-DATA",
              "section": "Unit and numeric policy",
              "kind": "sourced",
              "derivation": "the section makes durations nonnegative and rates non-negative; this quantity is additionally one the definition divides by, scales by, or spends, so zero is excluded as well and the bound is exclusive rather than inclusive"
            }
          }
        },
        "armor": {
          "type": "integer",
          "description": "Overrides the player baseline.",
          "minimum": 0,
          "x-authority": {
            "minimum": {
              "source": "TDD-CONTENT-DATA",
              "section": "Unit and numeric policy",
              "kind": "sourced",
              "derivation": "the section makes counts integral; this one is summed into a report column across the catalog, so zero is authored rather than omitted and the floor is zero rather than one"
            }
          }
        },
        "recovery_hull_per_second": {
          "type": "number",
          "description": "Overrides the player baseline.",
          "minimum": 0,
          "x-authority": {
            "minimum": {
              "source": "TDD-CONTENT-DATA",
              "section": "Unit and numeric policy",
              "kind": "sourced",
              "derivation": "the section states that durations are nonnegative and that rates cannot be negative, so the floor of every duration and rate is zero and there is no upper bound the section supplies"
            }
          }
        },
        "movement_speed_m_per_s": {
          "type": "number",
          "description": "Overrides the player baseline.",
          "exclusiveMinimum": 0,
          "x-authority": {
            "exclusiveMinimum": {
              "source": "TDD-CONTENT-DATA",
              "section": "Unit and numeric policy",
              "kind": "sourced",
              "derivation": "the section makes durations nonnegative and rates non-negative; this quantity is additionally one the definition divides by, scales by, or spends, so zero is excluded as well and the bound is exclusive rather than inclusive"
            }
          }
        },
        "collision_diameter_m": {
          "type": "number",
          "description": "Overrides the player baseline.",
          "exclusiveMinimum": 0,
          "x-authority": {
            "exclusiveMinimum": {
              "source": "TDD-CONTENT-DATA",
              "section": "Unit and numeric policy",
              "kind": "sourced",
              "derivation": "the section makes durations nonnegative and rates non-negative; this quantity is additionally one the definition divides by, scales by, or spends, so zero is excluded as well and the bound is exclusive rather than inclusive"
            }
          }
        }
      },
      "required": []
    },
    "top_down_silhouette": {
      "type": "array",
      "description": "Authored art direction for the top-down silhouette.",
      "items": {
        "type": "string"
      }
    },
    "rules": {
      "type": "array",
      "description": "Rule clarifications with no structured twin.",
      "items": {
        "type": "string"
      }
    }
  },
  "$defs": {
    "snake_case_field": {
      "title": "A schema-declared field name",
      "description": "Property names use snake_case.",
      "type": "string",
      "pattern": "^[a-z][a-z0-9_]*$"
    },
    "version": {
      "title": "A positive integer version",
      "description": "The initial schema_version and content_version of every first-authored definition is 1.",
      "type": "integer",
      "minimum": 1,
      "x-authority": {
        "minimum": {
          "source": "TDD-CONTENT-DATA",
          "section": "Initial versions",
          "kind": "sourced",
          "derivation": "the initial value of every first-authored definition is 1 and both versions only ever increment, so no valid version is below 1; there is no upper bound because a definition may be revised without limit"
        }
      }
    },
    "status": {
      "title": "Lifecycle state",
      "type": "string",
      "enum": [
        "development",
        "enabled",
        "disabled",
        "retired"
      ]
    },
    "name_key": {
      "title": "Localization key for the player-facing name",
      "type": "string",
      "pattern": "^[a-z][a-z0-9_]*\\.[A-Za-z0-9][A-Za-z0-9_-]*\\.name$"
    },
    "summary_key": {
      "title": "Localization key for the concise player-facing summary",
      "type": "string",
      "pattern": "^[a-z][a-z0-9_]*\\.[A-Za-z0-9][A-Za-z0-9_-]*\\.summary$"
    },
    "tags": {
      "title": "Closed query and tooling vocabulary",
      "description": "The vocabulary starts empty, so [] is the only accepted value.",
      "type": "array",
      "uniqueItems": true,
      "items": {
        "type": "string",
        "enum": []
      }
    },
    "source_refs": {
      "title": "The sources this definition implements",
      "type": "array",
      "uniqueItems": true,
      "items": {
        "type": "string",
        "pattern": "^(?:[a-z][a-z0-9_]*(?:\\.[a-z][a-z0-9_]*|\\[\\]|\\[[0-9]+\\]|\\[[0-9]+\\.\\.[0-9]+\\])*: )?(?:(?:GDD|TDD)-[A-Z0-9-]+|DEC-[0-9]{3}|TDR-[0-9]{3}|TR-[A-Z]+-[0-9]{3})(?:#[a-z0-9-]+)?$"
      }
    },
    "presentation_id": {
      "title": "Logical presentation entry, required absent",
      "description": "Required absent: a definition carrying this field is an error. No accepted document says what a presentation definition contains, so no ID grammar has been minted for one, and minting a shape for a category with zero members would be inventing structure ahead of need. The field was declared-optional with a non-empty-string constraint, which accepted any string an author invented and validated nothing about it; rejecting the field outright fails loudly the first time somebody adds one instead of accepting an unauthorized value. The subschema is 'not' over the empty schema, which rejects every instance, so the fault is the field's presence rather than its shape and an authored empty string is rejected by the same rule rather than as an empty declared-optional field. The typed validator reports MMC-2010 and names the field. When an accepted document mints a presentation ID grammar, this declaration becomes that grammar; until then it has no minLength, because a length bound on a value that can never be authored explains nothing.",
      "not": {}
    },
    "named_statistic": {
      "type": "string",
      "description": "A statistic from the shared vocabulary every trait, utility, PowerUp and relic modifies.",
      "enum": [
        "weapon-damage",
        "weapon-attack-rate",
        "weapon-area",
        "weapon-duration",
        "weapon-damage-to-elites-and-bosses",
        "maximum-hull-integrity",
        "armor",
        "recovery",
        "revival-charges",
        "movement-speed",
        "discovery-radius",
        "forward-extraction-rate",
        "extraction-zone-radius",
        "mined-common-ore",
        "recharge-time",
        "stored-charges",
        "control-resistance"
      ]
    }
  }
}
